<!ELEMENT Orgnization (Item+)*>
<!ATTLIST Orgnization
        InFile              CDATA            #REQUIRED
        OutFile             CDATA            #REQUIRED
        ModelName           CDATA            #REQUIRED
        POINames            CDATA            #REQUIRED
> 
<!ELEMENT Item (Name)*>
<!ATTLIST Item
        Name              CDATA            #REQUIRED
> 


