<!DOCTYPE Orgnization  SYSTEM 'Orgnization.dtd'>
<Orgnization InFile="workspace/lhchcg/myrep/atlas/decorated/atlas_hgamgam_asimov_decorated.root" OutFile="workspace/lhchcg/myrep/atlas/handler/atlas_hgamgam_asimov_handler.root"
	     ModelName="param_BR"
	     POINames="mH,muF_gg,muV_gg,mu,lambda_mu,lambda_muF_gg,lambda_muV_gg,dmH_gZ,dmH_exp">

  <Item Name="mu[1]"/>
  <Item Name="muF_gg[1,-5,5]"/>
  <Item Name="muV_gg[1,-5,5]"/>

  <!-- <Item Name="mu_BR_gamgam_temp[1]"/> -->

  <!-- <Item Name="prod::RF_comp(RF_gg,mu_BR_gamgam_temp)"/> -->
  <!-- <Item Name="prod::RV_comp(RV_gg,mu_BR_gamgam_temp)"/> -->

  <Item Name="lambda_mu[1]"/>
  <Item Name="lambda_muF_gg[1]"/>
  <Item Name="lambda_muV_gg[1]"/>

  <Item Name="dmH_gZ[0]"/>
  <Item Name="dmH_exp[0]"/>

  <Item Name="mH[125,120,130]"/>  
  <Item Name="prod::RF_comp(muF_gg,mu,lambda_muF_gg,lambda_mu)"/>
  <Item Name="prod::RV_comp(muV_gg,mu,lambda_muV_gg,lambda_mu)"/>

  <Item Name="sum::mH_comp(mH,dmH_gZ,dmH_exp)"/>

  <Item Name= "EDIT::NEWPDF(OLDPDF,
	       mH=mH_comp,
	       RF=RF_comp,
	       RV=RV_comp
       	       )" />
</Orgnization>
