<!DOCTYPE Orgnization  SYSTEM 'Orgnization.dtd'>
<Orgnization InFile="#INPUT#" OutFile="#OUTPUT#"
	     ModelName="param_BR"
	     POINames="MH,RF_gg,RV_gg">
  <Item Name="MH[125,120,130]"/>
  <Item Name="RF_gg[1,0,10]"/>
  <Item Name="RV_gg[1,-10,10]"/>
  <Item Name="mu_BR_gamgam_temp[1]"/>

  <Item Name="prod::RF_comp(RF_gg,mu_BR_gamgam_temp)"/>
  <Item Name="prod::RV_comp(RV_gg,mu_BR_gamgam_temp)"/>

  <Item Name= "EDIT::NEWPDF(OLDPDF,
	       mH=MH,
	       RF=RF_comp,
	       RV=RV_comp
       	       )" />
</Orgnization>
