<!DOCTYPE Orgnization  SYSTEM 'Orgnization.dtd'>
<Orgnization InFile="workspace/lhchcg/couplings/atlas/ttH/atlas_tthgg_coupling_asimov.root" OutFile="atlas_tthgg_coupling_asimov_param_NLO.root"
	     ModelName="CWCZCbCtaCto"
	     POINames="CT">
  <Item Name="CW[1]"/>
  <Item Name="CZ[1]"/>
  <Item Name="Cb[1]"/>
  <Item Name="Cm[1]"/>
  <Item Name="Cta[1]"/>
  <Item Name="CT[1,-100,100]"/>
  <Item Name="one[1]"/>
  <Item Name="pluone[+1]"/>
  <Item Name="onehalf[0.5]"/>

  <Item Name="expr::Cto('@0*@1', CT, pluone)"/>

  <!-- PRODUCTION -->
  <!-- gluglu->H, 7TeV -->
  <Item Name="expr::C2_GlGlH_7TeV('(@0*@0)*@2  + (@1*@1)*@3 + (@0*@1)*@4', Cto, Cb, sigma_tt_o_sigma_ggH_GlGlH_7TeV[1.0592],sigma_bb_o_sigma_ggH_GlGlH_7TeV[0.0070],sigma_tb_o_sigma_ggH_GlGlH_7TeV[-0.0662])"/>
  <!-- gluglu->H, 8TeV -->
  <Item Name="expr::C2_GlGlH_8TeV('(@0*@0)*@2  + (@1*@1)*@3 + (@0*@1)*@4', Cto, Cb, sigma_tt_o_sigma_ggH_GlGlH_8TeV[1.0580],sigma_bb_o_sigma_ggH_GlGlH_8TeV[0.0070],sigma_tb_o_sigma_ggH_GlGlH_8TeV[-0.0650])"/>
  <!-- VBF->H, 7TeV -->
  <Item Name="expr::C2_VBFH_7TeV('((@0*@0)*@2  + (@1*@1)*@3)', CZ, CW, CZFracVBF_7TeV[0.2548],CWFracVBF_7TeV[0.7452])"/>
  <!-- VBF->H, 8TeV -->
  <Item Name="expr::C2_VBFH_8TeV('((@0*@0)*@2  + (@1*@1)*@3)', CZ, CW, CZFracVBF_8TeV[0.2563],CWFracVBF_8TeV[0.7437])"/>

  <Item Name="expr::CW2('@0*@0',CW)"/>
  <Item Name="expr::CZ2('@0*@0',CZ)"/>
  <Item Name="expr::Cb2('@0*@0',Cb)"/>
  <Item Name="expr::Cm2('@0*@0',Cm)"/>
  <Item Name="expr::Ctau2('@0*@0',Cta)"/>
  <Item Name="expr::Ctop2('@0*@0',Cto)"/>


  <!-- tH xsec and efficiencies -->
  <Item Name="xsec_8TeV_wth_sm[0.00467]"/>
  <Item Name="xsec_8TeV_wth_np[0.0272]"/>
  <Item Name="xsec_8TeV_wth_null[0.00733]"/>
  <Item Name="xsec_8TeV_thjb_sm[0.017152]"/>
  <Item Name="xsec_8TeV_thjb_np[0.19722]"/>
  <Item Name="xsec_8TeV_thjb_null[0.058671]"/>

  <Item Name="eff_8TeV_wth_np[0.135866]"/>
  <Item Name="eff_8TeV_wth_null[0.120133]"/>
  <Item Name="eff_8TeV_wth_sm[0.118878]"/>
  <Item Name="eff_8TeV_thjb_null[0.0633131]"/>
  <Item Name="eff_8TeV_thjb_np[0.0650209]"/>
  <Item Name="eff_8TeV_thjb_sm[0.0615526]"/>

  <Item Name="xsec_7TeV_wth_sm[0.00286]"/>
  <Item Name="xsec_7TeV_wth_np[0.0162]"/>
  <Item Name="xsec_7TeV_wth_null[0.00429]"/>
  <Item Name="xsec_7TeV_thjb_sm[0.0111104]"/>
  <Item Name="xsec_7TeV_thjb_np[0.12876]"/>
  <Item Name="xsec_7TeV_thjb_null[0.0400]"/>

  <Item Name="eff_7TeV_wth_np[0.146362]"/>
  <Item Name="eff_7TeV_wth_null[0.131073]"/>
  <Item Name="eff_7TeV_wth_sm[0.128528]"/>
  <Item Name="eff_7TeV_thjb_null[0.0656412]"/>
  <Item Name="eff_7TeV_thjb_np[0.0669837]"/>
  <Item Name="eff_7TeV_thjb_sm[0.0618059]"/>

  <Item Name="expr::wt_tH_sm('((@0*@0)+(@0*@1))*@2',Cto,CW,onehalf)"/>
  <Item Name="expr::wt_tH_np('((@0*@0)-(@0*@1))*@2',Cto,CW,onehalf)"/>
  <Item Name="expr::wt_tH_null('((@1*@1)-(@0*@0))',Cto,CW)"/>

  <Item Name="expr::C2_7TeV_tHjb('((@0*@3*@6)  + (@1*@4*@7) + (@2*@5*@8))/(@3*@6)', wt_tH_sm, wt_tH_np, wt_tH_null, xsec_7TeV_thjb_sm, xsec_7TeV_thjb_np, xsec_7TeV_thjb_null, eff_7TeV_thjb_sm, eff_7TeV_thjb_np, eff_7TeV_thjb_null)"/>

  <Item Name="expr::C2_7TeV_WtH('((@0*@3*@6)  + (@1*@4*@7) + (@2*@5*@8))/(@3*@6)', wt_tH_sm, wt_tH_np, wt_tH_null, xsec_7TeV_wth_sm, xsec_7TeV_wth_np, xsec_7TeV_wth_null, eff_7TeV_wth_sm, eff_7TeV_wth_np, eff_7TeV_wth_null)"/>

  <Item Name="expr::C2_8TeV_tHjb('((@0*@3*@6)  + (@1*@4*@7) + (@2*@5*@8))/(@3*@6)', wt_tH_sm, wt_tH_np, wt_tH_null, xsec_8TeV_thjb_sm, xsec_8TeV_thjb_np, xsec_8TeV_thjb_null, eff_8TeV_thjb_sm, eff_8TeV_thjb_np, eff_8TeV_thjb_null)"/>

  <Item Name="expr::C2_8TeV_WtH('((@0*@3*@6)  + (@1*@4*@7) + (@2*@5*@8))/(@3*@6)', wt_tH_sm, wt_tH_np, wt_tH_null, xsec_8TeV_wth_sm, xsec_8TeV_wth_np, xsec_8TeV_wth_null, eff_8TeV_wth_sm, eff_8TeV_wth_np, eff_8TeV_wth_null)"/>

  <!-- DECAY -->
  <!-- H->gamgam -->
  <Item Name="expr::C2_HGaGa('(@0*@0)*@4 + (@1*@1)*@5 + (@2*@2)*@6 + (@0*@1)*@7 + (@0*@2)*@8 + (@1*@2)*@9 + (@3*@3)*@10 + (@0*@3)*@11 + (@1*@3)*@12 + (@2*@3)*@13',Cto,Cb,CW,Cta,G_tt_o_G_HGaGa[0.0715],G_bb_o_G_HGaGa[0.0000],G_WW_o_G_HGaGa[1.5887],G_tb_o_G_HGaGa[-0.0018],G_tW_o_G_HGaGa[-0.6740],G_bW_o_G_HGaGa[0.0083],G_ll_o_G_HGaGa[0.0000],G_tl_o_G_HGaGa[-0.0019],G_bl_o_G_HGaGa[0.0000],G_lW_o_G_HGaGa[0.0090])"/>
  <!-- H->Zgam -->
  <Item Name="expr::C2_HZGa('(@0*@0)*@4 + (@1*@1)*@5 + (@2*@2)*@6 + (@0*@1)*@7 + (@0*@2)*@8 + (@1*@2)*@9 + (@3*@3)*@10 + (@0*@3)*@11 + (@1*@3)*@12 + (@2*@3)*@13',Cto,Cb,CW,Cta,G_tt_o_G_HZGa[0.0035],G_bb_o_G_HZGa[0.0000],G_WW_o_G_HZGa[1.1180],G_tb_o_G_HZGa[-0.0002],G_tW_o_G_HZGa[-0.1245],G_bW_o_G_HZGa[0.0032],G_ll_o_G_HZGa[0.0000],G_tl_o_G_HZGa[-0.0000],G_bl_o_G_HZGa[0.0000],G_lW_o_G_HZGa[0.0001])"/>
  <!-- H->gluglu -->
  <Item Name="expr::C2_HGlGl('(@0*@0)*@2  + (@1*@1)*@3 + (@0*@1)*@4', Cto, Cb, G_tt_o_G_gg_HGlGl[1.1114],G_bb_o_G_gg_HGlGl[0.0116],G_tb_o_G_gg_HGlGl[-0.1229])"/>
  <!-- total width -->
  <Item Name="expr::invC2H('1/(@0*@11 + @1*@12 + @2*@13 + @3*@14 + @4*@15 + @5*@16 + @6*@17 + @7*@17 + @8*@16 + @9*@18 + @10*@18)', BR_H_gluglu_SM[0.0850],BR_H_gamgam_SM[0.0023],BR_H_Zgam_SM[0.0016],BR_H_WW_SM[0.2240],BR_H_ZZ_SM[0.0279],BR_H_bb_SM[0.5690],BR_H_tautau_SM[0.0628],BR_H_mumu_SM[0.0002],BR_H_ssbar_SM[0.0004],BR_H_ccbar_SM[0.0264],BR_H_ttbar_SM[0.0000], C2_HGlGl, C2_HGaGa, C2_HZGa, CW2, CZ2, Cb2, Ctau2, Ctop2)"/>

  <!-- PDF -->
  <Item Name="EDIT::NEWPDF(OLDPDF,
	      mu_ggH=one,
	      mu_ggH_7TeV=C2_GlGlH_7TeV,
	      mu_ggH_8TeV=C2_GlGlH_8TeV,
	      mu_VBF=one,
	      mu_VBF_7TeV=C2_VBFH_7TeV,
	      mu_VBF_8TeV=C2_VBFH_7TeV,
	      mu_WH=CW2,
	      mu_ZH=CZ2,
	      mu_ttH=Ctop2,
	      mu_bbH=Cb2,
	      mu_tH=one,
	      mu_tH_7TeV=one,
	      mu_tH_8TeV=one,
	      mu_tHjb=one,
	      mu_tHjb_7TeV=C2_7TeV_tHjb,
	      mu_WtH_7TeV=C2_7TeV_WtH,
	      mu_WtH=one,
	      mu_tHjb_8TeV=C2_8TeV_tHjb,
	      mu_WtH_8TeV=C2_8TeV_WtH,
	      mu_BR_gg=C2_HGaGa,
	      mu=invC2H)"/>
</Orgnization>
